{
  "$schema": "https://json-schema.org/draft/2020-12/schema",
  "$id": "https://dagents.local/workgroup-d05/FixtureMeta.json",
  "title": "FixtureMeta",
  "type": "object",
  "required": [
    "fixture_schema",
    "test",
    "given",
    "when",
    "then"
  ],
  "properties": {
    "fixture_schema": {
      "const": "workgroup-d05-fixture/v1"
    },
    "test": {
      "type": "string",
      "minLength": 1
    },
    "subcase": {
      "type": [
        "string",
        "null"
      ]
    },
    "compare": {
      "enum": [
        "exact_json_unless_noted",
        "subset"
      ]
    },
    "provider": {
      "type": "string"
    },
    "note": {
      "type": "string"
    },
    "given": {
      "type": "object"
    },
    "when": {
      "oneOf": [
        {
          "type": "object",
          "required": [
            "op"
          ]
        },
        {
          "type": "array",
          "items": {
            "type": "object",
            "required": [
              "op"
            ]
          }
        }
      ]
    },
    "then": {
      "type": "object"
    },
    "illegal_config": {
      "type": "object"
    }
  },
  "additionalProperties": false
}
