{
  "fixture_schema": "workgroup-d05-fixture/v1",
  "compare": "exact_json_unless_noted",
  "test": "provision_retry_same_id_ok",
  "given": {
    "workgroup": {
      "workgroup_id": "wg_01hworkgroup000000000000",
      "status": "active",
      "acl": {
        "owners": [
          "node_01ha000000000000000000"
        ],
        "collaborators": [
          "node_01hb000000000000000000"
        ],
        "revision": 1
      }
    },
    "member": {
      "member_id": "mb_01hmember00000000000000",
      "home_node_id": "node_01hb000000000000000000",
      "status": "requested",
      "member_generation": 1,
      "member_spec_digest": "sha256:5045f5acc432f3f9fc64c14c1275d4c808f26b02b69acc1cdc60674ef1de238c"
    },
    "grant": {
      "status": "accepted",
      "home_node_id": "node_01hb000000000000000000",
      "member_spec_digest": "sha256:5045f5acc432f3f9fc64c14c1275d4c808f26b02b69acc1cdc60674ef1de238c",
      "lease_epoch": 2,
      "member_generation": 1,
      "tool_allow_names": [
        "read_file"
      ]
    }
  },
  "when": [
    {
      "op": "member.provision",
      "provision_id": "pv_01hprov0000000000000000",
      "member_spec_digest": "sha256:5045f5acc432f3f9fc64c14c1275d4c808f26b02b69acc1cdc60674ef1de238c"
    },
    {
      "op": "member.provision",
      "provision_id": "pv_01hprov0000000000000000",
      "member_spec_digest": "sha256:5045f5acc432f3f9fc64c14c1275d4c808f26b02b69acc1cdc60674ef1de238c"
    }
  ],
  "then": {
    "workspace_created_count": 1,
    "member_status": "ready",
    "second_response": {
      "idempotent": true,
      "code": null
    }
  }
}
