{
  "fixture_schema": "workgroup-d05-fixture/v1",
  "compare": "exact_json_unless_noted",
  "test": "node_policy_can_only_tighten",
  "given": {
    "workgroup": {
      "workgroup_id": "wg_01h00000000000000000000001",
      "status": "active",
      "acl": {
        "owners": [
          "node_a"
        ],
        "collaborators": [
          "node_b"
        ],
        "revision": 1
      }
    },
    "member": {
      "member_id": "mb_01h00000000000000000000002",
      "home_node_id": "node_b",
      "status": "ready",
      "member_generation": 1,
      "member_spec_digest": "sha256:5045f5acc432f3f9fc64c14c1275d4c808f26b02b69acc1cdc60674ef1de238c"
    },
    "grant": {
      "status": "accepted",
      "home_node_id": "node_b",
      "member_spec_digest": "sha256:5045f5acc432f3f9fc64c14c1275d4c808f26b02b69acc1cdc60674ef1de238c",
      "lease_epoch": 2,
      "member_generation": 1,
      "tool_allow_names": [
        "read_file"
      ]
    },
    "spec_policy_ceiling": {
      "bash": "ask"
    },
    "node_local_policy": {
      "bash": "deny"
    }
  },
  "when": {
    "op": "evaluate_policy",
    "tool": "bash"
  },
  "then": {
    "effective": "deny"
  }
}
