{
  "fixture_schema": "workgroup-d05-fixture/v1",
  "compare": "exact_json_unless_noted",
  "test": "non_idempotent_handler_executes_once",
  "given": {
    "workgroup": {
      "workgroup_id": "wg_01hworkgroup000000000000",
      "status": "active",
      "acl": {
        "owners": [
          "node_01ha000000000000000000"
        ],
        "collaborators": [
          "node_01hb000000000000000000"
        ],
        "revision": 1
      }
    },
    "member": {
      "member_id": "mb_01hmember00000000000000",
      "home_node_id": "node_01hb000000000000000000",
      "status": "ready",
      "member_generation": 1,
      "member_spec_digest": "sha256:5045f5acc432f3f9fc64c14c1275d4c808f26b02b69acc1cdc60674ef1de238c"
    },
    "grant": {
      "status": "accepted",
      "home_node_id": "node_01hb000000000000000000",
      "member_spec_digest": "sha256:5045f5acc432f3f9fc64c14c1275d4c808f26b02b69acc1cdc60674ef1de238c",
      "lease_epoch": 2,
      "member_generation": 1,
      "tool_allow_names": [
        "read_file"
      ]
    },
    "handler": "test_counter_increment",
    "command_id": "cmd_01hcmd00000000000000000",
    "counter": 0
  },
  "when": [
    {
      "op": "journal.accept"
    },
    {
      "op": "ws.drop"
    },
    {
      "op": "manage.retry_same_command_id"
    }
  ],
  "then": {
    "counter": 1
  }
}
