{
  "fixture_schema": "workgroup-d05-fixture/v1",
  "compare": "exact_json_unless_noted",
  "test": "provision_same_id_different_digest_conflict",
  "given": {
    "workgroup": {
      "workgroup_id": "wg_01h00000000000000000000001",
      "status": "active",
      "acl": {
        "owners": [
          "node_a"
        ],
        "collaborators": [
          "node_b"
        ],
        "revision": 1
      }
    },
    "member": {
      "member_id": "mb_01h00000000000000000000002",
      "home_node_id": "node_b",
      "status": "ready",
      "member_generation": 1,
      "member_spec_digest": "sha256:5045f5acc432f3f9fc64c14c1275d4c808f26b02b69acc1cdc60674ef1de238c"
    },
    "grant": {
      "status": "accepted",
      "home_node_id": "node_b",
      "member_spec_digest": "sha256:5045f5acc432f3f9fc64c14c1275d4c808f26b02b69acc1cdc60674ef1de238c",
      "lease_epoch": 2,
      "member_generation": 1,
      "tool_allow_names": [
        "read_file"
      ]
    },
    "existing_provision_id": "pv_01h00000000000000000000009",
    "existing_digest": "sha256:5045f5acc432f3f9fc64c14c1275d4c808f26b02b69acc1cdc60674ef1de238c"
  },
  "when": {
    "op": "member.provision",
    "provision_id": "pv_01h00000000000000000000009",
    "member_spec_digest": "sha256:d9298a10d1b0735837dc4bd85dac641b0f3cef27a47e5d53a54f2f3f5b2fcffa"
  },
  "then": {
    "code": "payload_conflict"
  }
}
