{
  "fixture_schema": "workgroup-d05-fixture/v1",
  "compare": "exact_json_unless_noted",
  "test": "manage_restart_pending_assign",
  "given": {
    "workgroup": {
      "workgroup_id": "wg_01hworkgroup000000000000",
      "status": "active",
      "acl": {
        "owners": [
          "node_01ha000000000000000000"
        ],
        "collaborators": [
          "node_01hb000000000000000000"
        ],
        "revision": 1
      }
    },
    "member": {
      "member_id": "mb_01hmember00000000000000",
      "home_node_id": "node_01hb000000000000000000",
      "status": "ready",
      "member_generation": 1,
      "member_spec_digest": "sha256:5045f5acc432f3f9fc64c14c1275d4c808f26b02b69acc1cdc60674ef1de238c"
    },
    "grant": {
      "status": "accepted",
      "home_node_id": "node_01hb000000000000000000",
      "member_spec_digest": "sha256:5045f5acc432f3f9fc64c14c1275d4c808f26b02b69acc1cdc60674ef1de238c",
      "lease_epoch": 2,
      "member_generation": 1,
      "tool_allow_names": [
        "read_file"
      ]
    },
    "assign": {
      "assign_id": "as_01hassign00000000000000",
      "status": "running",
      "member_id": "mb_01hmember00000000000000"
    },
    "outbox": [
      {
        "type": "tool.command",
        "command_id": "cmd_01hcmd00000000000000000",
        "acked": false
      }
    ]
  },
  "when": {
    "op": "manage.crash_restart"
  },
  "then": {
    "assign_reloaded_status": "running",
    "duplicate_assign_created": false,
    "outbox_reconciled": true
  }
}
